,imagem,id,cod_sku_rede,fabricante,nome_prod,preço,preço_promocional,data
540,https://atacadaobr.vtexassets.com/arquivos/ids/273222/g.jpg?v=638428907418470000,326,326,Santa Helena,Doce Paçoca Santa Helena Paçoquita Rolha Embalada Caixa com 100 unidades,26.99,26.99,2024-05-27 16:28:14.655373
541,https://atacadaobr.vtexassets.com/arquivos/ids/240811/g.jpg?v=638353844954000000,10033,10033,Ypê,Amaciante de Roupas Ypê Aconchego Frasco com 2L,9.45,9.45,2024-05-27 16:28:14.655373
542,https://atacadaobr.vtexassets.com/arquivos/ids/272028/m.jpg?v=638416811943630000,32833,32833,Piracanjuba,Leite Longa Vida Piracanjuba Com tampa Desnatado TP com 1L,5.69,5.69,2024-05-27 16:28:14.655373
543,https://atacadaobr.vtexassets.com/arquivos/ids/254666/g.jpg?v=638353996426430000,11647,11647,Brahma,Cerveja Brahma Duplo Malte Lata com 269ml,2.29,2.29,2024-05-27 16:28:14.655373
544,https://atacadaobr.vtexassets.com/arquivos/ids/272027/g.jpg?v=638416811932400000,32845,32845,Piracanjuba,Leite Longa Vida Piracanjuba Com tampa Semidesnatado TP com 1L,5.69,5.69,2024-05-27 16:28:14.655373
545,https://atacadaobr.vtexassets.com/arquivos/ids/268956/p.jpg?v=638380523330100000,31856,31856,Condor,Vassoura Limpa Piso Condor Sem cabo Unidade,3.5,3.5,2024-05-27 16:28:14.655373
546,https://atacadaobr.vtexassets.com/arquivos/ids/245229/g.jpg?v=638353893025770000,15295,15295,Pampers,Fralda Descartável Pampers Supersec Jumbo XG Pacote com 68 unidades,84.5,84.5,2024-05-27 16:28:14.655373
547,https://atacadaobr.vtexassets.com/arquivos/ids/282504/g.jpg?v=638466061247900000,10188,10188,Dove,Sabonete Dove Branco Pacote com 8x90g,24.9,24.9,2024-05-27 16:28:14.655373
548,https://atacadaobr.vtexassets.com/arquivos/ids/273605/g.jpg?v=638432363769030000,5447,5447,Antarctica,Refrigerante Guaraná Antarctica Lata com 350ml,2.49,2.49,2024-05-27 16:28:14.655373
549,https://atacadaobr.vtexassets.com/arquivos/ids/294895/m.jpg?v=638480748447630000,11580,11580,Brahma,Cerveja Brahma Chopp Lata com 350ml,2.99,2.99,2024-05-27 16:28:14.655373
550,https://atacadaobr.vtexassets.com/arquivos/ids/279171/g.jpg?v=638460881683670000,35621,35621,Tixan,Detergente em Pó Tixan Maciez Caixeta com 800g,10.2,10.2,2024-05-27 16:28:14.655373
551,https://atacadaobr.vtexassets.com/arquivos/ids/231002/g.jpg?v=638353736880530000,21889,21889,Italac,Bebida Láctea Italac Chocolate TP com 200ml,1.07,1.07,2024-05-27 16:28:14.655373
552,https://atacadaobr.vtexassets.com/arquivos/ids/295843/m.jpg?v=638484206453370000,20156,20156,Gomes da Costa,Sardinha Gomes da Costa Óleo Lata com 75g,5.9,5.9,2024-05-27 16:28:14.655373
553,https://atacadaobr.vtexassets.com/arquivos/ids/230337/g.jpg?v=638353729590000000,13267,13267,Skol,Cerveja Skol Lata com 350ml,3.75,3.75,2024-05-27 16:28:14.655373
554,https://atacadaobr.vtexassets.com/arquivos/ids/278603/p.jpg?v=638460876084900000,21096,21096,Snob,Guardanapo de Papel Snob 24x22cm Pacote com 50 unidades,2.39,2.39,2024-05-27 16:28:14.655373
555,https://atacadaobr.vtexassets.com/arquivos/ids/240812/g.jpg?v=638353844981930000,10212,10212,Ypê,Amaciante para Roupas Ypê Aconchego Bombona com 5L,22.05,22.05,2024-05-27 16:28:14.655373
556,https://atacadaobr.vtexassets.com/arquivos/ids/245227/g.jpg?v=638353893003030000,15291,15291,Pampers,Fralda Descartável Pampers Supersec Jumbo M Pacote com 90 unidades,84.5,84.5,2024-05-27 16:28:14.655373
557,https://atacadaobr.vtexassets.com/arquivos/ids/268516/m.jpg?v=638379664266130000,2607,2607,Zero-Cal,Adoçante Líquido Zero-Cal Sacarina Frasco com 100ml,4.99,4.99,2024-05-27 16:28:14.655373
558,https://atacadaobr.vtexassets.com/arquivos/ids/268133/m.jpg?v=638379660156000000,13341,13341,Cisne,Sal Cisne Refinado Extra Pacote com 1kg,3.55,3.55,2024-05-27 16:28:14.655373
559,https://atacadaobr.vtexassets.com/arquivos/ids/284811/p.jpg?v=638467789733800000,4575,4575,Condor,Escova Lavadeira Condor Oval nº 16 Unidade,1.69,1.69,2024-05-27 16:28:14.655373
560,https://atacadaobr.vtexassets.com/arquivos/ids/280485/m.jpg?v=638464337928230000,8827,8827,Fugini,Milho Verde Fugini Pouch com 170g,2.9,2.9,2024-05-27 16:28:14.655373
561,https://atacadaobr.vtexassets.com/arquivos/ids/268539/g.jpg?v=638379664500600000,8365,8365,Anaconda,Farinha de Trigo Anaconda Tipo 1 Pacote com 1kg,3.69,3.69,2024-05-27 16:28:14.655373
562,https://atacadaobr.vtexassets.com/arquivos/ids/281159/g.jpg?v=638465199160670000,329,329,Santa Helena,Doce Paçoca Santa Helena Paçoquita Rolha Embalada Pote com 50x15g,24.99,24.99,2024-05-27 16:28:14.655373
563,https://atacadaobr.vtexassets.com/arquivos/ids/268869/m.jpg?v=638379667974670000,30295,30295,Klass,Toalha de Papel Klass 50 folhas Pacote com 2 rolos,4.05,4.05,2024-05-27 16:28:14.655373
564,https://atacadaobr.vtexassets.com/arquivos/ids/282168/g.jpg?v=638465209183930000,39118,39118,Pampers,Fralda Descartável Pampers Pants G Pacote com 72 unidades,121.5,121.5,2024-05-27 16:28:14.655373
565,https://atacadaobr.vtexassets.com/arquivos/ids/282541/g.jpg?v=638466061624300000,1834,1834,Baly,Energético Baly Tradicional Pet com 2L,8.52,8.52,2024-05-27 16:28:14.655373
566,https://atacadaobr.vtexassets.com/arquivos/ids/263245/g.jpg?v=638354090346470000,28692,28692,Oral-B,Creme Dental Oral-B 1-2-3 Caixeta com 12x70g,26,26,2024-05-27 16:28:14.655373
567,https://atacadaobr.vtexassets.com/arquivos/ids/299172/g.jpg?v=638515307438770000,3963,3963,Mondial,Caixa Amplificada Mondial Bivolt - 400W Unidade,379,379,2024-05-27 16:28:14.655373
568,https://atacadaobr.vtexassets.com/arquivos/ids/278620/p.jpg?v=638460876254770000,36713,36713,Ypê,Detergente Líquido Ypê Coco Frasco com 500ml,2.35,2.35,2024-05-27 16:28:14.655373
569,https://atacadaobr.vtexassets.com/arquivos/ids/272296/g.jpg?v=638417677114870000,39114,39114,Pampers,Fralda Descartável Pampers Pants XG Pacote com 66 unidades,121.5,121.5,2024-05-27 16:28:14.655373
570,https://atacadaobr.vtexassets.com/arquivos/ids/278553/p.jpg?v=638460875621070000,21076,21076,Santepel,Guardanapo de Papel Santepel 24x22cm Pacote com 50 unidades,2.29,2.29,2024-05-27 16:28:14.655373
571,https://atacadaobr.vtexassets.com/arquivos/ids/237789/g.jpg?v=638353811713970000,25314,25314,Bic,Isqueiro Bic Maxi Cartela com 12 unidades,55.9,55.9,2024-05-27 16:28:14.655373
572,https://atacadaobr.vtexassets.com/arquivos/ids/246483/g.jpg?v=638353906944200000,9716,9716,Mococa,Mistura Láctea Condensada Mococa TP com 395g,3.56,3.56,2024-05-27 16:28:14.655373
573,https://atacadaobr.vtexassets.com/arquivos/ids/241034/g.jpg?v=638353847412030000,25610,25610,Personal,Papel Higiênico Personal Vip Folha dupla - 30m Pacote com 12 rolos,17.9,17.9,2024-05-27 16:28:14.655373
574,https://atacadaobr.vtexassets.com/arquivos/ids/286013/g.jpg?v=638467801501400000,3853,3853,União,Café União Tradicional Pouch com 500g,12.95,12.95,2024-05-27 16:28:14.655373
575,https://atacadaobr.vtexassets.com/arquivos/ids/285496/p.jpg?v=638467796550770000,12911,12911,Embalixo,Saco para Lixo Embalixo Super econômico - 50L Rolo com 50 unidades,5.7,5.7,2024-05-27 16:28:14.655373
576,https://atacadaobr.vtexassets.com/arquivos/ids/288893/p.jpg?v=638468674751370000,3263,3263,Nissin,Macarrão Instantâneo Nissin Cup Noodles Galinha caipira Copo com 69g,4.79,4.79,2024-05-27 16:28:14.655373
577,https://atacadaobr.vtexassets.com/arquivos/ids/246349/g.jpg?v=638353905478030000,12864,12864,Original,Cerveja Original Lata com 350ml,4.3,4.3,2024-05-27 16:28:14.655373
578,https://atacadaobr.vtexassets.com/arquivos/ids/285087/m.jpg?v=638467792425600000,8665,8665,Kicaldo,Milho para Pipoca Kicaldo Pacote com 500g,2.85,2.85,2024-05-27 16:28:14.655373
579,https://atacadaobr.vtexassets.com/arquivos/ids/275423/g.jpg?v=638437549254400000,15112,15112,Pampers,Fralda Descartável Pampers Confort Sec P Pacote com 72 unidades,93.9,93.9,2024-05-27 16:28:14.655373
580,https://atacadaobr.vtexassets.com/arquivos/ids/260394/g.jpg?v=638354059277930000,15107,15107,Pampers,Fralda Descartável Pampers Confort Sec M Pacote com 70 unidades,93.9,93.9,2024-05-27 16:28:14.655373
581,https://atacadaobr.vtexassets.com/arquivos/ids/279172/p.jpg?v=638460881693670000,35701,35701,Tixan,Detergente em Pó Tixan Primavera Caixeta com 800g,10.2,10.2,2024-05-27 16:28:14.655373
582,https://atacadaobr.vtexassets.com/arquivos/ids/256642/g.jpg?v=638354018255800000,25621,25621,Personal,Papel Higiênico Personal Vip Folha dupla - 30m Pacote com 24 rolos,35.78,35.78,2024-05-27 16:28:14.655373
583,https://atacadaobr.vtexassets.com/arquivos/ids/279987/p.jpg?v=638464331559400000,20382,20382,Menina,Coco Ralado Menina Sachê com 100g,3.25,3.25,2024-05-27 16:28:14.655373
584,https://atacadaobr.vtexassets.com/arquivos/ids/256250/g.jpg?v=638354013840200000,35011,35011,Brilhante,Detergente em Pó Brilhante Limpeza Total Pacote com 800g,10.9,10.9,2024-05-27 16:28:14.655373
585,https://atacadaobr.vtexassets.com/arquivos/ids/268441/m.jpg?v=638379663479730000,3297,3297,Nissin,Macarrão Instantâneo Nissin Lámen Carne Pacote com 85g,2.17,2.17,2024-05-27 16:28:14.655373
586,https://atacadaobr.vtexassets.com/arquivos/ids/240637/g.jpg?v=638353843067700000,32364,32364,Italac,Leite Longa Vida Italac Semidesnatado Com tampa TP com 1L,5.39,5.39,2024-05-27 16:28:14.655373
587,https://atacadaobr.vtexassets.com/arquivos/ids/279308/p.jpg?v=638460883057700000,35346,35346,Omo,Detergente em Pó Omo Expert Roupas Brancas Caixeta com 720g,14.9,14.9,2024-05-27 16:28:14.655373
588,https://atacadaobr.vtexassets.com/arquivos/ids/281094/p.jpg?v=638465198506270000,17444,17444,Kit Kat,"Chocolate Kit Kat Nestlé Dark Unidade com 41,5g",2.95,2.95,2024-05-27 16:28:14.655373
589,https://atacadaobr.vtexassets.com/arquivos/ids/230145/g.jpg?v=638353727504270000,19548,19548,Panelux,"Panela de Pressão Panelux Polida - 4,5L Unidade",39.9,39.9,2024-05-27 16:28:14.655373
590,https://atacadaobr.vtexassets.com/arquivos/ids/283889/g.jpg?v=638466928072770000,5645,5645,Scotch-Brite,Esponja Scotch-Brite Extrema Pacote com 4 unidades,4.55,4.55,2024-05-27 16:28:14.655373
591,https://atacadaobr.vtexassets.com/arquivos/ids/254659/g.jpg?v=638353996347370000,102,102,Always,Absorvente Always Super Proteção Suave Pacote com 10 unidades,3.4,3.4,2024-05-27 16:28:14.655373
592,https://atacadaobr.vtexassets.com/arquivos/ids/279288/p.jpg?v=638460882880030000,35580,35580,Tixan,Detergente em Pó Tixan Antibac Caixeta com 800g,7.89,7.89,2024-05-27 16:28:14.655373
593,https://atacadaobr.vtexassets.com/arquivos/ids/278695/p.jpg?v=638460877022530000,5700,5700,Assolan,Esponja Sintética Assolan Pertuto Unidade,0.65,0.65,2024-05-27 16:28:14.655373
594,https://atacadaobr.vtexassets.com/arquivos/ids/245230/g.jpg?v=638353893037300000,15300,15300,Pampers,Fralda Descartável Pampers Supersec Jumbo XXG Pacote com 64 unidades,84.5,84.5,2024-05-27 16:28:14.655373
595,https://atacadaobr.vtexassets.com/arquivos/ids/280187/g.jpg?v=638464334079100000,26385,26385,Heinz,Ketchup Heinz Tradicional Pet com 567g,14.2,14.2,2024-05-27 16:28:14.655373
596,https://atacadaobr.vtexassets.com/arquivos/ids/280901/m.jpg?v=638465196522070000,31872,31872,Bauducco,Biscoito Wafer Bauducco Chocolate Pacote com 140g,3.65,3.65,2024-05-27 16:28:14.655373
597,https://atacadaobr.vtexassets.com/arquivos/ids/278554/p.jpg?v=638460875630830000,28670,28670,Wilkinson,Lâmina de Barbear Wilkinson Cartela com 60 unidades,22.99,22.99,2024-05-27 16:28:14.655373
598,https://atacadaobr.vtexassets.com/arquivos/ids/241794/g.jpg?v=638353855690770000,12004,12004,Corona,Cerveja Coronita Extra One Way Long neck com 210ml,4.69,4.69,2024-05-27 16:28:14.655373
599,https://atacadaobr.vtexassets.com/arquivos/ids/231842/g.jpg?v=638353746343370000,10394,10394,Comfort,Amaciante para Roupas Concentrado Comfort Azul Frasco com 500ml,10.2,10.2,2024-05-27 16:28:14.655373
600,https://atacadaobr.vtexassets.com/arquivos/ids/272305/m.jpg?v=638418539452700000,30538,30538,Italac,Leite Condensado Italac Semidesnatado TP com 395g,4.79,4.79,2024-05-27 16:28:19.116514
601,https://atacadaobr.vtexassets.com/arquivos/ids/281407/g.jpg?v=638465201590400000,31415,31415,Ninho,Leite em Pó Ninho Integral Lata com 380g,15.99,15.99,2024-05-27 16:28:19.116514
602,https://atacadaobr.vtexassets.com/arquivos/ids/233162/g.jpg?v=638353761184700000,32346,32346,Italac,Leite Longa Vida Italac Com tampa Integral TP com 1L,5.39,5.39,2024-05-27 16:28:19.116514
603,https://atacadaobr.vtexassets.com/arquivos/ids/272006/m.jpg?v=638416811680300000,30692,30692,Piracanjuba,Leite Condensado Piracanjuba Semidesnatado TP com 395g,4.99,4.99,2024-05-27 16:28:19.116514
604,https://atacadaobr.vtexassets.com/arquivos/ids/229475/g.jpg?v=638353720309100000,13743,13743,Camil,Arroz Camil Agulhinha - Tipo 1 Pacote com 5kg,32.65,32.65,2024-05-27 16:28:19.116514
605,https://atacadaobr.vtexassets.com/arquivos/ids/272026/m.jpg?v=638416811920370000,32839,32839,Piracanjuba,Leite Longa Vida Piracanjuba Com tampa Integral TP com 1L,5.69,5.69,2024-05-27 16:28:19.116514
606,https://atacadaobr.vtexassets.com/arquivos/ids/268123/g.jpg?v=638379660041570000,27280,27280,Italac,Creme de Leite Italac TP com 200g,2.99,2.99,2024-05-27 16:28:19.116514
607,https://atacadaobr.vtexassets.com/arquivos/ids/230776/g.jpg?v=638353734437070000,30596,30596,Marajoara,Leite Condensado Marajoara Semidesnatado TP com 395g,4.99,4.99,2024-05-27 16:28:19.116514
608,https://atacadaobr.vtexassets.com/arquivos/ids/239783/g.jpg?v=638353833768500000,12476,12476,Heineken,Cerveja Heineken Long Neck com 330ml,6.2,6.2,2024-05-27 16:28:19.116514
609,https://atacadaobr.vtexassets.com/arquivos/ids/230682/g.jpg?v=638353733341500000,2371,2371,União,Açúcar União Refinado Pacote com 1kg,5.49,5.49,2024-05-27 16:28:19.116514
610,https://atacadaobr.vtexassets.com/arquivos/ids/277276/p.jpg?v=638447916154000000,11276,11276,Amstel,Cerveja Amstel Sleek Lata com 350ml,3.19,3.19,2024-05-27 16:28:19.116514
611,https://atacadaobr.vtexassets.com/arquivos/ids/281244/g.jpg?v=638465199991470000,35385,35385,Garoto,Bombom Garoto Sortido Caixeta com 250g,11.9,11.9,2024-05-27 16:28:19.116514
612,https://atacadaobr.vtexassets.com/arquivos/ids/245228/g.jpg?v=638353893014230000,15285,15285,Pampers,Fralda Descartável Pampers Supersec Jumbo G Pacote com 80 unidades,84.5,84.5,2024-05-27 16:28:19.116514
613,https://atacadaobr.vtexassets.com/arquivos/ids/263896/g.jpg?v=638354097480170000,12486,12486,Heineken,Cerveja Heineken Sleek Lata com 350ml,4.79,4.79,2024-05-27 16:28:19.116514
614,https://atacadaobr.vtexassets.com/arquivos/ids/284804/m.jpg?v=638467789673200000,25779,25779,Report,Papel Sulfite Report A4 75g Pacote com 500 folhas,20.99,20.99,2024-05-27 16:28:19.116514
615,https://atacadaobr.vtexassets.com/arquivos/ids/266451/p.jpg?v=638363244863230000,39395,39395,Ypê,Sabão em Pedaço Ypê Neutro Promocional Pacote com 5x180g,9.45,9.45,2024-05-27 16:28:19.116514
616,https://atacadaobr.vtexassets.com/arquivos/ids/229445/g.jpg?v=638353719983070000,13748,13748,Camil,Arroz Camil Agulhinha Tipo 1 Pacote com 1kg,6.53,6.53,2024-05-27 16:28:19.116514
617,https://atacadaobr.vtexassets.com/arquivos/ids/273005/m.jpg?v=638424587449770000,2455,2455,Red Bull,Energético Red Bull Lata com 250ml,9.49,9.49,2024-05-27 16:28:19.116514
618,https://atacadaobr.vtexassets.com/arquivos/ids/256710/g.jpg?v=638354019023970000,12460,12460,Heineken,Cerveja Heineken Lata com 269ml,3.8,3.8,2024-05-27 16:28:19.116514
619,https://atacadaobr.vtexassets.com/arquivos/ids/268713/g.jpg?v=638379666336300000,13410,13410,Lebre,Sal Lebre Refinado Pacote com 1kg,2.15,2.15,2024-05-27 16:28:19.116514
620,https://atacadaobr.vtexassets.com/arquivos/ids/281093/p.jpg?v=638465198495800000,17423,17423,Nestlé,"Chocolate Kit Kat Nestlé Ao Leite Unidade com 41,5g",2.95,2.95,2024-05-27 16:28:19.116514
621,https://atacadaobr.vtexassets.com/arquivos/ids/279016/g.jpg?v=638460880218430000,35370,35370,Omo,Detergente em Pó Omo Lavagem perfeita Caixeta com 800g,14.9,14.9,2024-05-27 16:28:19.116514
622,https://atacadaobr.vtexassets.com/arquivos/ids/239784/g.jpg?v=638353833779600000,11244,11244,Amstel,Cerveja Amstel Lata com 269ml,2.75,2.75,2024-05-27 16:28:19.116514
623,https://atacadaobr.vtexassets.com/arquivos/ids/238822/g.jpg?v=638353823229700000,29157,29157,Ferrero,Creme Ferrero Nutella Avelã com Cacau Pote com 650g,39.35,39.35,2024-05-27 16:28:19.116514
624,https://atacadaobr.vtexassets.com/arquivos/ids/233349/g.jpg?v=638353763157600000,26366,26366,Maratá,Suco Néctar Maratá Uva TP com 200ml,1.45,1.45,2024-05-27 16:28:19.116514
625,https://atacadaobr.vtexassets.com/arquivos/ids/280465/m.jpg?v=638464337718670000,12924,12924,Fugini,Molho de Tomate Fugini Tradicional Pouch com 300g,1.49,1.49,2024-05-27 16:28:19.116514
626,https://atacadaobr.vtexassets.com/arquivos/ids/249387/g.jpg?v=638353938702970000,30241,30241,Omo,Lava Roupas Líquido Omo Lavagem perfeita Bombona com 5L,52.5,52.5,2024-05-27 16:28:19.116514
627,https://atacadaobr.vtexassets.com/arquivos/ids/282261/g.jpg?v=638465210140230000,40694,40694,Ninho,Leite em Pó Ninho Integral Instantâneo Lata com 380g,15.99,15.99,2024-05-27 16:28:19.116514
628,https://atacadaobr.vtexassets.com/arquivos/ids/278555/m.jpg?v=638460875640600000,36410,36410,Limpol,Detergente Líquido Limpol Neutro Frasco com 500ml,2.35,2.35,2024-05-27 16:28:19.116514
629,https://atacadaobr.vtexassets.com/arquivos/ids/280539/g.jpg?v=638464338528300000,13415,13415,Quero,Molho de Tomate Quero Tradicional Pouch com 300g,2.25,2.25,2024-05-27 16:28:19.116514
630,https://atacadaobr.vtexassets.com/arquivos/ids/279096/g.jpg?v=638460880991230000,10429,10429,Flor de Ypê,Sabonete Flor de Ypê Frésia e pêssego Unidade com 85g,1.23,1.23,2024-05-27 16:28:19.116514
631,https://atacadaobr.vtexassets.com/arquivos/ids/263377/g.jpg?v=638354091789700000,30354,30354,Snob,Toalha de Papel Snob Clássica 60 folhas Pacote com 2 rolos,6.3,6.3,2024-05-27 16:28:19.116514
632,https://atacadaobr.vtexassets.com/arquivos/ids/281051/p.jpg?v=638465198060900000,28839,28839,Passatempo,Biscoito Recheado Passatempo Nestlé Chocolate Pacote com 130g,2.15,2.15,2024-05-27 16:28:19.116514
633,https://atacadaobr.vtexassets.com/arquivos/ids/275011/g.jpg?v=638435825010370000,30101,30101,Brilhante,Lava Roupas Líquido Brilhante PRO Lavanderia Profissional Bombona com 7L,60,60,2024-05-27 16:28:19.116514
634,https://atacadaobr.vtexassets.com/arquivos/ids/229743/g.jpg?v=638353723200470000,23204,23204,Toddynho,Bebida Láctea Toddynho Chocolate TP com 200ml,2.25,2.25,2024-05-27 16:28:19.116514
635,https://atacadaobr.vtexassets.com/arquivos/ids/282629/p.jpg?v=638466062500400000,35396,35396,Omo,"Detergente em Pó Omo Lavagem perfeita Pacote com 2,4kg",29.9,29.9,2024-05-27 16:28:19.116514
636,https://atacadaobr.vtexassets.com/arquivos/ids/298936/g.jpg?v=638514443932300000,29144,29144,Ferrero,Creme Ferrero Nutella Avelã com Cacau Pote com 140g,10.15,10.15,2024-05-27 16:28:19.116514
637,https://atacadaobr.vtexassets.com/arquivos/ids/268473/p.jpg?v=638379663823530000,34507,34507,Veja,Limpador Multiuso Veja Original Frasco com 500ml,5.2,5.2,2024-05-27 16:28:19.116514
638,https://atacadaobr.vtexassets.com/arquivos/ids/284743/p.jpg?v=638467789099630000,3092,3092,Pilão,Café Pilão Vácuo Pacote com 500g,14.5,14.5,2024-05-27 16:28:19.116514
639,https://atacadaobr.vtexassets.com/arquivos/ids/263769/g.jpg?v=638354096060830000,38919,38919,Nescau,Achocolatado em Pó Nescau Lata com 370g,6.99,6.99,2024-05-27 16:28:19.116514
640,https://atacadaobr.vtexassets.com/arquivos/ids/273222/g.jpg?v=638428907418470000,326,326,Santa Helena,Doce Paçoca Santa Helena Paçoquita Rolha Embalada Caixa com 100 unidades,26.99,26.99,2024-05-27 16:28:19.116514
641,https://atacadaobr.vtexassets.com/arquivos/ids/240811/g.jpg?v=638353844954000000,10033,10033,Ypê,Amaciante de Roupas Ypê Aconchego Frasco com 2L,9.45,9.45,2024-05-27 16:28:19.116514
642,https://atacadaobr.vtexassets.com/arquivos/ids/272028/m.jpg?v=638416811943630000,32833,32833,Piracanjuba,Leite Longa Vida Piracanjuba Com tampa Desnatado TP com 1L,5.69,5.69,2024-05-27 16:28:19.116514
643,https://atacadaobr.vtexassets.com/arquivos/ids/254666/g.jpg?v=638353996426430000,11647,11647,Brahma,Cerveja Brahma Duplo Malte Lata com 269ml,2.29,2.29,2024-05-27 16:28:19.116514
644,https://atacadaobr.vtexassets.com/arquivos/ids/272027/g.jpg?v=638416811932400000,32845,32845,Piracanjuba,Leite Longa Vida Piracanjuba Com tampa Semidesnatado TP com 1L,5.69,5.69,2024-05-27 16:28:19.116514
645,https://atacadaobr.vtexassets.com/arquivos/ids/268956/p.jpg?v=638380523330100000,31856,31856,Condor,Vassoura Limpa Piso Condor Sem cabo Unidade,3.5,3.5,2024-05-27 16:28:19.116514
646,https://atacadaobr.vtexassets.com/arquivos/ids/245229/g.jpg?v=638353893025770000,15295,15295,Pampers,Fralda Descartável Pampers Supersec Jumbo XG Pacote com 68 unidades,84.5,84.5,2024-05-27 16:28:19.116514
647,https://atacadaobr.vtexassets.com/arquivos/ids/282504/g.jpg?v=638466061247900000,10188,10188,Dove,Sabonete Dove Branco Pacote com 8x90g,24.9,24.9,2024-05-27 16:28:19.116514
648,https://atacadaobr.vtexassets.com/arquivos/ids/273605/g.jpg?v=638432363769030000,5447,5447,Antarctica,Refrigerante Guaraná Antarctica Lata com 350ml,2.49,2.49,2024-05-27 16:28:19.116514
649,https://atacadaobr.vtexassets.com/arquivos/ids/294895/m.jpg?v=638480748447630000,11580,11580,Brahma,Cerveja Brahma Chopp Lata com 350ml,2.99,2.99,2024-05-27 16:28:19.116514
650,https://atacadaobr.vtexassets.com/arquivos/ids/279171/g.jpg?v=638460881683670000,35621,35621,Tixan,Detergente em Pó Tixan Maciez Caixeta com 800g,10.2,10.2,2024-05-27 16:28:19.116514
651,https://atacadaobr.vtexassets.com/arquivos/ids/231002/g.jpg?v=638353736880530000,21889,21889,Italac,Bebida Láctea Italac Chocolate TP com 200ml,1.07,1.07,2024-05-27 16:28:19.116514
652,https://atacadaobr.vtexassets.com/arquivos/ids/295843/m.jpg?v=638484206453370000,20156,20156,Gomes da Costa,Sardinha Gomes da Costa Óleo Lata com 75g,5.9,5.9,2024-05-27 16:28:19.116514
653,https://atacadaobr.vtexassets.com/arquivos/ids/230337/g.jpg?v=638353729590000000,13267,13267,Skol,Cerveja Skol Lata com 350ml,3.75,3.75,2024-05-27 16:28:19.116514
654,https://atacadaobr.vtexassets.com/arquivos/ids/278603/p.jpg?v=638460876084900000,21096,21096,Snob,Guardanapo de Papel Snob 24x22cm Pacote com 50 unidades,2.39,2.39,2024-05-27 16:28:19.116514
655,https://atacadaobr.vtexassets.com/arquivos/ids/240812/g.jpg?v=638353844981930000,10212,10212,Ypê,Amaciante para Roupas Ypê Aconchego Bombona com 5L,22.05,22.05,2024-05-27 16:28:19.116514
656,https://atacadaobr.vtexassets.com/arquivos/ids/245227/g.jpg?v=638353893003030000,15291,15291,Pampers,Fralda Descartável Pampers Supersec Jumbo M Pacote com 90 unidades,84.5,84.5,2024-05-27 16:28:19.116514
657,https://atacadaobr.vtexassets.com/arquivos/ids/268516/m.jpg?v=638379664266130000,2607,2607,Zero-Cal,Adoçante Líquido Zero-Cal Sacarina Frasco com 100ml,4.99,4.99,2024-05-27 16:28:19.116514
658,https://atacadaobr.vtexassets.com/arquivos/ids/268133/m.jpg?v=638379660156000000,13341,13341,Cisne,Sal Cisne Refinado Extra Pacote com 1kg,3.55,3.55,2024-05-27 16:28:19.116514
659,https://atacadaobr.vtexassets.com/arquivos/ids/284811/p.jpg?v=638467789733800000,4575,4575,Condor,Escova Lavadeira Condor Oval nº 16 Unidade,1.69,1.69,2024-05-27 16:28:19.116514
660,https://atacadaobr.vtexassets.com/arquivos/ids/280485/m.jpg?v=638464337928230000,8827,8827,Fugini,Milho Verde Fugini Pouch com 170g,2.9,2.9,2024-05-27 16:28:19.116514
661,https://atacadaobr.vtexassets.com/arquivos/ids/268539/g.jpg?v=638379664500600000,8365,8365,Anaconda,Farinha de Trigo Anaconda Tipo 1 Pacote com 1kg,3.69,3.69,2024-05-27 16:28:19.116514
662,https://atacadaobr.vtexassets.com/arquivos/ids/281159/g.jpg?v=638465199160670000,329,329,Santa Helena,Doce Paçoca Santa Helena Paçoquita Rolha Embalada Pote com 50x15g,24.99,24.99,2024-05-27 16:28:19.116514
663,https://atacadaobr.vtexassets.com/arquivos/ids/268869/m.jpg?v=638379667974670000,30295,30295,Klass,Toalha de Papel Klass 50 folhas Pacote com 2 rolos,4.05,4.05,2024-05-27 16:28:19.116514
664,https://atacadaobr.vtexassets.com/arquivos/ids/282168/g.jpg?v=638465209183930000,39118,39118,Pampers,Fralda Descartável Pampers Pants G Pacote com 72 unidades,121.5,121.5,2024-05-27 16:28:19.116514
665,https://atacadaobr.vtexassets.com/arquivos/ids/282541/g.jpg?v=638466061624300000,1834,1834,Baly,Energético Baly Tradicional Pet com 2L,8.52,8.52,2024-05-27 16:28:19.116514
666,https://atacadaobr.vtexassets.com/arquivos/ids/263245/g.jpg?v=638354090346470000,28692,28692,Oral-B,Creme Dental Oral-B 1-2-3 Caixeta com 12x70g,26,26,2024-05-27 16:28:19.116514
667,https://atacadaobr.vtexassets.com/arquivos/ids/299172/g.jpg?v=638515307438770000,3963,3963,Mondial,Caixa Amplificada Mondial Bivolt - 400W Unidade,379,379,2024-05-27 16:28:19.116514
668,https://atacadaobr.vtexassets.com/arquivos/ids/278620/p.jpg?v=638460876254770000,36713,36713,Ypê,Detergente Líquido Ypê Coco Frasco com 500ml,2.35,2.35,2024-05-27 16:28:19.116514
669,https://atacadaobr.vtexassets.com/arquivos/ids/272296/g.jpg?v=638417677114870000,39114,39114,Pampers,Fralda Descartável Pampers Pants XG Pacote com 66 unidades,121.5,121.5,2024-05-27 16:28:19.116514
670,https://atacadaobr.vtexassets.com/arquivos/ids/278553/p.jpg?v=638460875621070000,21076,21076,Santepel,Guardanapo de Papel Santepel 24x22cm Pacote com 50 unidades,2.29,2.29,2024-05-27 16:28:19.116514
671,https://atacadaobr.vtexassets.com/arquivos/ids/237789/g.jpg?v=638353811713970000,25314,25314,Bic,Isqueiro Bic Maxi Cartela com 12 unidades,55.9,55.9,2024-05-27 16:28:19.116514
672,https://atacadaobr.vtexassets.com/arquivos/ids/246483/g.jpg?v=638353906944200000,9716,9716,Mococa,Mistura Láctea Condensada Mococa TP com 395g,3.56,3.56,2024-05-27 16:28:19.116514
673,https://atacadaobr.vtexassets.com/arquivos/ids/241034/g.jpg?v=638353847412030000,25610,25610,Personal,Papel Higiênico Personal Vip Folha dupla - 30m Pacote com 12 rolos,17.9,17.9,2024-05-27 16:28:19.116514
674,https://atacadaobr.vtexassets.com/arquivos/ids/286013/g.jpg?v=638467801501400000,3853,3853,União,Café União Tradicional Pouch com 500g,12.95,12.95,2024-05-27 16:28:19.116514
